{
  "contractVersion": "1.0",
  "regionId": "r7",
  "lookId": 412,
  "frameId": 4812,
  "tMs": 93204411,
  "rect": {
    "x": 72,
    "y": 412,
    "w": 1296,
    "h": 1296
  },
  "source": "finder",
  "kind": "object",
  "objectness": 0.87,
  "postRect": {
    "x": 0,
    "y": 228,
    "w": 1440,
    "h": 1780
  },
  "parentRegionId": "r3",
  "phash": "9f3a5c7e12b48d60",
  "ownOverlayFraction": 0.0
}
